ID	EN	SP	FR	GE	RU
intro_panel_1	Nothing beats the drop. Sinking into a world of pure motion.	Nada supera la caída. Hundiéndose en un mundo de puro movimiento.	Rien ne vaut la chute. Plonger dans un monde de mouvement pur.	Nichts geht über den Abstieg. Eintauchen in eine Welt reiner Bewegung.	Ничто не сравнится с погружением. Погружение в мир чистого движения.
intro_panel_2	Coral reefs are home to colors and creatures found nowhere else on earth!	Los arrecifes de coral albergan colores y criaturas que no se encuentran en ningún otro lugar de la Tierra.	Les récifs coralliens abritent des couleurs et des créatures introuvables ailleurs sur Terre !	Korallenriffe beherbergen Farben und Lebewesen, die es nirgendwo sonst auf der Erde gibt!	Коралловые рифы — дом для красок и существ, которых больше нигде на Земле не найти!
intro_panel_3	But the tide has turned, and our actions below have left many scars.	Pero la marea ha cambiado, y nuestras acciones bajo el agua han dejado muchas cicatrices.	Mais la marée a tourné, et nos actions sous la surface ont laissé de profondes cicatrices.	Doch die Gezeiten haben sich gewendet, und unser Tun unter der Oberfläche hat viele Narben hinterlassen.	Но прилив изменился, и наши действия под водой оставили множество шрамов.
intro_panel_4	Since 1950, half of the world's coral reefs are gone, left to bleach and rot.	Desde 1950, la mitad de los arrecifes de coral del mundo han desaparecido, dejados para blanquearse y pudrirse.	Depuis 1950, la moitié des récifs coralliens mondiaux ont disparu, laissés à blanchir et pourrir.	Seit 1950 sind die Hälfte der Korallenriffe der Welt verschwunden, dem Ausbleichen und Verrotten überlassen.	С 1950 года исчезла половина коралловых рифов мира — они обесцвечиваются и гниют.
intro_panel_5	And it gets worse! A ruthless invader is stripping the reefs bare: Lionfish!	¡Y empeora! Un invasor despiadado está dejando los arrecifes desnudos: ¡el pez león!	Et ce n'est pas tout ! Un envahisseur impitoyable dévaste les récifs : le poisson-lion !	Und es kommt noch schlimmer! Ein gnadenloser Eindringling plündert die Riffe: der Feuerfisch!	И хуже того! Безжалостный захватчик опустошает рифы: рыба-лев!
intro_panel_6	So we fight back with steel; We sink massive ships to build new artificial reefs.	Así que contraatacamos con acero; Hundimos enormes barcos para construir nuevos arrecifes artificiales.	Alors nous ripostons avec l'acier ; Nous coulons d'immenses navires pour créer de nouveaux récifs artificiels.	Also schlagen wir mit Stahl zurück; Wir versenken riesige Schiffe, um neue künstliche Riffe zu schaffen.	И мы бьём в ответ сталью; тонем массивные корабли, чтобы создать новые искусственные рифы.
intro_panel_7	Now it's up to you! Hunt the invaders, Remove the debris, and restore the corals!	¡Ahora te toca a ti! Caza a los invasores, elimina los escombros y restaura los corales.	Maintenant, c'est à vous ! Chassez les envahisseurs, retirez les débris et restaurez les coraux !	Jetzt bist du dran! Jag die Eindringlinge, beseitige den Schutt und stelle die Korallen wieder her!	Теперь всё зависит от вас! Охотьтесь на захватчиков, убирайте обломки и восстанавливайте кораллы!
intro_panel_8	Now splash into action! Ocean protection starts now.	¡Ahora sumérgete en la acción! La protección del océano comienza ahora.	Maintenant, plongez dans l'action ! La protection des océans commence maintenant.	Jetzt ins kalte Wasser! Ozeanschutz beginnt jetzt.	Вперёд в действие! Защита океана начинается прямо сейчас.
